{
  "$schema": "https://json-schema.org/draft/2020-12/schema",
  "$id": "https://notice2action.action4ai.internal/schemas/v1/notice.schema.json",
  "title": "NoticeToActionNotice",
  "description": "Standardized schema contract (v1.0) for evidence-linked extraction of official notices.",
  "type": "object",
  "required": [
    "notice_id",
    "category",
    "category_confidence",
    "title",
    "issuer",
    "summary_plain",
    "affected_party",
    "deadlines",
    "required_documents",
    "action_steps",
    "submission_channel",
    "fees_penalties",
    "warnings",
    "document_quality"
  ],
  "properties": {
    "notice_id": {
      "type": "string",
      "description": "Unique identifier for the notice processing job (UUID format recommended)."
    },
    "schema_version": {
      "type": "string",
      "default": "1.0",
      "description": "Version of the notice contract schema."
    },
    "category": {
      "type": "string",
      "enum": [
        "scholarship",
        "bank",
        "utility",
        "tax",
        "govt_scheme",
        "unsupported"
      ],
      "description": "High-level classification category of the notice. Unsupported notices must be classified as 'unsupported'."
    },
    "category_confidence": {
      "type": "number",
      "minimum": 0.0,
      "maximum": 1.0,
      "description": "Classification confidence score from 0.0 to 1.0."
    },
    "title": {
      "$ref": "#/$defs/EvidenceFieldString",
      "description": "Official title or subject heading of the notice."
    },
    "issuer": {
      "$ref": "#/$defs/EvidenceFieldString",
      "description": "Issuing agency, government department, institution, or bank."
    },
    "summary_plain": {
      "$ref": "#/$defs/EvidenceFieldString",
      "description": "Plain language non-technical summary of what the notice requires."
    },
    "affected_party": {
      "$ref": "#/$defs/EvidenceFieldString",
      "description": "Target audience or designated affected person/entity (e.g. Student, Account Holder)."
    },
    "deadlines": {
      "type": "array",
      "description": "List of all deadlines mentioned in the notice.",
      "items": {
        "$ref": "#/$defs/DeadlineItem"
      }
    },
    "required_documents": {
      "type": "array",
      "description": "List of checklist documents mentioned in the notice.",
      "items": {
        "$ref": "#/$defs/RequiredDocumentItem"
      }
    },
    "action_steps": {
      "type": "array",
      "description": "Ordered sequence of action steps directly derived from notice evidence.",
      "items": {
        "$ref": "#/$defs/ActionStepItem"
      }
    },
    "submission_channel": {
      "$ref": "#/$defs/EvidenceFieldString",
      "description": "Mode of submission or response (e.g., online portal URL, branch visit, email address, physical postal mail)."
    },
    "fees_penalties": {
      "type": "array",
      "description": "Financial penalties, late fees, or required fees with evidence.",
      "items": {
        "$ref": "#/$defs/FeePenaltyItem"
      }
    },
    "warnings": {
      "type": "array",
      "description": "Uncertainty warnings, ambiguity notes, illegible scan alerts, or caveats.",
      "items": {
        "$ref": "#/$defs/WarningItem"
      }
    },
    "document_quality": {
      "type": "string",
      "enum": [
        "good",
        "poor_scan",
        "incomplete"
      ],
      "description": "Assessment of input document readability and completeness."
    },
    "page_count": {
      "type": "integer",
      "minimum": 1,
      "description": "Total number of pages processed in the notice."
    },
    "extracted_at": {
      "type": "string",
      "format": "date-time",
      "description": "ISO 8601 timestamp when extraction was completed."
    }
  },
  "$defs": {
    "Evidence": {
      "type": "object",
      "required": ["page", "quote"],
      "properties": {
        "page": {
          "type": ["integer", "null"],
          "minimum": 1,
          "description": "1-indexed page number where the quotation was located, or null if not found."
        },
        "quote": {
          "type": ["string", "null"],
          "description": "Exact verbatim substring from the source document backing this extraction, or null."
        }
      },
      "additionalProperties": false
    },
    "EvidenceFieldString": {
      "type": "object",
      "required": ["value", "evidence", "status"],
      "properties": {
        "value": {
          "type": ["string", "null"],
          "description": "Extracted string value, or null if not found in notice."
        },
        "evidence": {
          "$ref": "#/$defs/Evidence"
        },
        "status": {
          "type": "string",
          "enum": ["found", "uncertain", "not_found"],
          "description": "Extraction verification status."
        }
      },
      "additionalProperties": false
    },
    "DeadlineItem": {
      "type": "object",
      "required": ["label", "original_text", "iso_date", "evidence", "status"],
      "properties": {
        "label": {
          "type": "string",
          "description": "Descriptive label for this deadline (e.g. 'Scholarship Portal Close', 'Objection Window')."
        },
        "original_text": {
          "type": "string",
          "description": "Original raw date expression verbatim from notice text."
        },
        "iso_date": {
          "type": ["string", "null"],
          "description": "Parsed ISO 8601 date string (YYYY-MM-DD or YYYY-MM-DDTHH:MM:SS), or null if relative/ambiguous."
        },
        "evidence": {
          "$ref": "#/$defs/Evidence"
        },
        "status": {
          "type": "string",
          "enum": ["found", "ambiguous", "conflicting", "not_found"],
          "description": "Status of the deadline identification."
        }
      },
      "additionalProperties": false
    },
    "RequiredDocumentItem": {
      "type": "object",
      "required": ["name", "explicitly_required", "evidence", "status"],
      "properties": {
        "name": {
          "type": "string",
          "description": "Document name or certificate specification."
        },
        "explicitly_required": {
          "type": "boolean",
          "description": "True if explicitly mandated by the notice; false if recommended or optional."
        },
        "evidence": {
          "$ref": "#/$defs/Evidence"
        },
        "status": {
          "type": "string",
          "enum": ["found", "uncertain", "not_found"],
          "description": "Verification status of the document requirement."
        }
      },
      "additionalProperties": false
    },
    "ActionStepItem": {
      "type": "object",
      "required": ["order", "text", "evidence", "status"],
      "properties": {
        "order": {
          "type": "integer",
          "minimum": 1,
          "description": "1-indexed execution sequence order for this step."
        },
        "text": {
          "type": "string",
          "description": "Instruction for the citizen/recipient strictly derived from notice text."
        },
        "evidence": {
          "$ref": "#/$defs/Evidence"
        },
        "status": {
          "type": "string",
          "enum": ["found", "uncertain", "not_found"],
          "description": "Confidence status of this action step."
        }
      },
      "additionalProperties": false
    },
    "FeePenaltyItem": {
      "type": "object",
      "required": ["description", "amount", "evidence", "status"],
      "properties": {
        "description": {
          "type": "string",
          "description": "Description of the fee, late charge, or consequence."
        },
        "amount": {
          "type": ["string", "number", "null"],
          "description": "Monetary penalty amount or rate, or null if unspecified."
        },
        "evidence": {
          "$ref": "#/$defs/Evidence"
        },
        "status": {
          "type": "string",
          "enum": ["found", "uncertain", "not_found"],
          "description": "Verification status."
        }
      },
      "additionalProperties": false
    },
    "WarningItem": {
      "type": "object",
      "required": ["code", "message", "severity"],
      "properties": {
        "code": {
          "type": "string",
          "description": "Machine-readable warning code (e.g., 'AMBIGUOUS_DATE', 'POOR_SCAN_QUALITY', 'UNSUPPORTED_CATEGORY')."
        },
        "message": {
          "type": "string",
          "description": "Human-readable explanation explaining what is uncertain or unverified."
        },
        "severity": {
          "type": "string",
          "enum": ["info", "warning", "critical"],
          "description": "Severity level of the warning."
        },
        "evidence": {
          "$ref": "#/$defs/Evidence"
        }
      },
      "additionalProperties": false
    }
  },
  "additionalProperties": false
}
